{
  "$schema": "https://json-schema.org/draft/2020-12/schema",
  "$id": "https://openacp.dev/schemas/scope-boundary.schema.json",
  "title": "OpenACP Scope Boundary",
  "type": "object",
  "required": ["schemaVersion", "artifactType", "inScope", "outOfScope", "deferred", "requiresHumanApproval", "forbiddenActions", "stopConditions", "scopeLeakExamples"],
  "properties": {
    "schemaVersion": { "const": "openacp-scope-boundary.v1" },
    "artifactType": { "const": "scope-boundary" },
    "inScope": { "$ref": "#/$defs/nonEmptyStrings" },
    "outOfScope": { "$ref": "#/$defs/nonEmptyStrings" },
    "deferred": { "type": "array", "items": { "type": "string" } },
    "requiresHumanApproval": { "$ref": "#/$defs/nonEmptyStrings" },
    "forbiddenActions": { "$ref": "#/$defs/nonEmptyStrings" },
    "stopConditions": { "$ref": "#/$defs/nonEmptyStrings" },
    "scopeLeakExamples": { "$ref": "#/$defs/nonEmptyStrings" }
  },
  "$defs": { "nonEmptyStrings": { "type": "array", "minItems": 1, "items": { "type": "string", "minLength": 1 } } },
  "additionalProperties": true
}
